{
  "schema": "identity.brand-kit-view-model/v1",
  "projectId": "mantle",
  "project": {
    "displayName": "Mantle",
    "repository": "https://github.com/egohygiene/mantle",
    "tagline": "A portable, user-owned shell environment built from explicit layers."
  },
  "release": {
    "version": "1.0.0",
    "profileVersion": "1.0.0",
    "sourceDigest": "fb5b86b632cb47eb160b13da92742687f5e76148b6d5300239a601b7d29147e8",
    "immutableId": "sha256:fb5b86b632cb47eb160b13da92742687f5e76148b6d5300239a601b7d29147e8",
    "status": "generated"
  },
  "tokens": [
    {
      "path": "color.action.primary",
      "type": "color",
      "value": {
        "alpha": 1,
        "colorSpace": "srgb",
        "components": [
          0.22,
          0.741,
          0.973
        ]
      },
      "sourceLayer": "mantle-product",
      "overrideReason": null,
      "approval": null
    },
    {
      "path": "color.brand.human",
      "type": "color",
      "value": {
        "alpha": 1,
        "colorSpace": "srgb",
        "components": [
          0.957,
          0.447,
          0.714
        ]
      },
      "sourceLayer": "mantle-product",
      "overrideReason": null,
      "approval": null
    },
    {
      "path": "color.brand.primary",
      "type": "color",
      "value": {
        "alpha": 1,
        "colorSpace": "srgb",
        "components": [
          0.22,
          0.741,
          0.973
        ]
      },
      "sourceLayer": "mantle-product",
      "overrideReason": "Mantle needs a crisp terminal-native signal that remains distinct within the Ego Hygiene family.",
      "approval": "approve-mantle-primary"
    },
    {
      "path": "color.brand.secondary",
      "type": "color",
      "value": {
        "alpha": 1,
        "colorSpace": "srgb",
        "components": [
          0.506,
          0.549,
          0.973
        ]
      },
      "sourceLayer": "mantle-product",
      "overrideReason": null,
      "approval": null
    },
    {
      "path": "color.canvas",
      "type": "color",
      "value": {
        "alpha": 1,
        "colorSpace": "srgb",
        "components": [
          0.973,
          0.973,
          0.988
        ]
      },
      "sourceLayer": "egohygiene-organization",
      "overrideReason": null,
      "approval": null
    },
    {
      "path": "color.terminal.canvas",
      "type": "color",
      "value": {
        "alpha": 1,
        "colorSpace": "srgb",
        "components": [
          0.008,
          0.024,
          0.09
        ]
      },
      "sourceLayer": "mantle-product",
      "overrideReason": null,
      "approval": null
    },
    {
      "path": "color.terminal.text",
      "type": "color",
      "value": {
        "alpha": 1,
        "colorSpace": "srgb",
        "components": [
          0.945,
          0.961,
          0.976
        ]
      },
      "sourceLayer": "mantle-product",
      "overrideReason": null,
      "approval": null
    },
    {
      "path": "color.text",
      "type": "color",
      "value": {
        "alpha": 1,
        "colorSpace": "srgb",
        "components": [
          0.067,
          0.082,
          0.149
        ]
      },
      "sourceLayer": "egohygiene-organization",
      "overrideReason": null,
      "approval": null
    },
    {
      "path": "motion.duration.reduced",
      "type": "duration",
      "value": {
        "unit": "ms",
        "value": 0
      },
      "sourceLayer": "egohygiene-organization",
      "overrideReason": null,
      "approval": null
    },
    {
      "path": "motion.duration.standard",
      "type": "duration",
      "value": {
        "unit": "ms",
        "value": 180
      },
      "sourceLayer": "egohygiene-organization",
      "overrideReason": null,
      "approval": null
    },
    {
      "path": "typography.body.family",
      "type": "fontFamily",
      "value": [
        "Inter",
        "system-ui",
        "sans-serif"
      ],
      "sourceLayer": "egohygiene-organization",
      "overrideReason": null,
      "approval": null
    }
  ],
  "assets": [
    {
      "id": "mark",
      "label": "Mantle layered shell mark",
      "mediaType": "image/svg+xml",
      "sha256": "88ca2ab2450bb58a66418eb08f9eff5e5271975a27547bdbfe359be27cd64be8",
      "altText": "Three nested prompt chevrons wrap a bright command cursor on a dark rounded square.",
      "dimensions": "64 × 64 SVG viewBox units",
      "intendedUse": "Use only the approved source or verified generated projections.",
      "safeZone": null,
      "text": "<svg xmlns=\"http://www.w3.org/2000/svg\" viewBox=\"0 0 64 64\" role=\"img\" aria-labelledby=\"title desc\">\n  <title id=\"title\">Mantle layered shell mark</title>\n  <desc id=\"desc\">Three nested prompt chevrons wrap a bright command cursor on a dark rounded square.</desc>\n  <defs>\n    <linearGradient id=\"mantle-accent\" x1=\"10\" x2=\"54\" y1=\"12\" y2=\"52\" gradientUnits=\"userSpaceOnUse\">\n      <stop offset=\"0\" stop-color=\"#38bdf8\"/>\n      <stop offset=\"0.52\" stop-color=\"#818cf8\"/>\n      <stop offset=\"1\" stop-color=\"#f472b6\"/>\n    </linearGradient>\n  </defs>\n  <rect width=\"64\" height=\"64\" rx=\"14\" fill=\"#020617\"/>\n  <path d=\"M14 17 27 32 14 47M24 17l13 15-13 15M41 43h10\" fill=\"none\" stroke=\"url(#mantle-accent)\" stroke-linecap=\"round\" stroke-linejoin=\"round\" stroke-width=\"5\"/>\n</svg>\n",
      "availability": "generated-download",
      "downloadPath": "brand/mark.svg",
      "license": {
        "spdx": "MIT",
        "status": "approved",
        "attribution": "Copyright 2026 Ego Hygiene"
      },
      "origin": {
        "creator": "Ego Hygiene",
        "method": "first-party",
        "source": "https://github.com/egohygiene/mantle/issues/27",
        "capturedAt": "2026-08-31T12:11:03Z"
      },
      "approval": "approve-mantle-mark",
      "usage": {
        "safeZone": "Keep one quarter of the mark width clear on every side.",
        "minimumSize": "16 CSS pixels.",
        "restrictions": [
          "Do not stretch, rotate, remove layers, or recolor outside approved tokens."
        ]
      },
      "kind": "mark",
      "notes": "Use only the approved source or verified generated projections."
    }
  ],
  "guidance": {
    "voice": {
      "status": "declared",
      "canonical": true,
      "value": {
        "$schema": "https://egohygiene.github.io/identity/contracts/v1/voice.schema.json",
        "characteristics": [
          {
            "description": "Put scope, consequence, and recovery before convenience claims.",
            "governance": {
              "approval": "approve-mantle-voice",
              "provenance": {
                "capturedAt": "2026-08-31T12:11:03Z",
                "method": "human-authored",
                "source": "DESIGN.md"
              },
              "state": "approved",
              "subject": "voice:mantle",
              "visibility": "public"
            },
            "id": "operator-respecting",
            "label": "Operator-respecting"
          },
          {
            "description": "Distinguish planned, running, partial, verified, failed, blocked, and unknown states.",
            "governance": {
              "approval": "approve-mantle-voice",
              "provenance": {
                "capturedAt": "2026-08-31T12:11:03Z",
                "method": "human-authored",
                "source": "DESIGN_SYSTEM.md"
              },
              "state": "approved",
              "subject": "voice:mantle",
              "visibility": "public"
            },
            "id": "state-explicit",
            "label": "State-explicit"
          }
        ],
        "contexts": [
          {
            "antiExamples": [
              {
                "governance": {
                  "approval": "approve-mantle-voice",
                  "provenance": {
                    "capturedAt": "2026-08-31T12:11:03Z",
                    "method": "human-authored",
                    "source": "DESIGN.md"
                  },
                  "state": "approved",
                  "subject": "voice:mantle",
                  "visibility": "public"
                },
                "id": "command-plan-overclaim",
                "rationale": "It hides scope, evidence, and user control.",
                "text": "Mantle magically fixes your entire development environment."
              }
            ],
            "audience": "A developer deciding whether to run a command that may change their environment.",
            "avoidedLanguage": [
              "magic",
              "just run",
              "nuke",
              "we own your shell"
            ],
            "capitalization": "Use sentence case.",
            "characteristics": [
              "operator-respecting",
              "state-explicit"
            ],
            "examples": [
              {
                "governance": {
                  "approval": "approve-mantle-voice",
                  "provenance": {
                    "capturedAt": "2026-08-31T12:11:03Z",
                    "method": "human-authored",
                    "source": "DESIGN.md"
                  },
                  "state": "approved",
                  "subject": "voice:mantle",
                  "visibility": "public"
                },
                "id": "command-plan-preview",
                "rationale": "It names the operation and preserves operator authority.",
                "text": "Review the installation plan before Mantle changes your shell startup file."
              }
            ],
            "governance": {
              "approval": "approve-mantle-voice",
              "provenance": {
                "capturedAt": "2026-08-31T12:11:03Z",
                "method": "human-authored",
                "source": "DESIGN.md"
              },
              "state": "approved",
              "subject": "voice:mantle",
              "visibility": "public"
            },